{
  "$comment": "Procedural planet generator. Periods are lattice cells across the whole map (every octave tiles the torus). landFraction is the share of vertices above sea level. peakiness 0..1 bends land heights toward low plains with rarer peaks.",
  "presets": [
    {
      "id": "continents",
      "basePeriod": 3,
      "octaves": 5,
      "persistence": 0.5,
      "landFraction": 0.56,
      "peakiness": 0.55,
      "terrace": {
        "step": 30,
        "flat": 0.6,
        "rampSlope": 18
      }
    },
    {
      "id": "islands",
      "basePeriod": 4,
      "octaves": 5,
      "persistence": 0.4,
      "landFraction": 0.48,
      "peakiness": 0.8,
      "terrace": {
        "step": 30,
        "flat": 0.6,
        "rampSlope": 18
      }
    }
  ],
  "trees": {
    "densityByBand": {
      "shore": 0,
      "lowland": 0.05,
      "grass": 0.1,
      "highland": 0.06,
      "rock": 0.015,
      "peak": 0
    },
    "clusterPeriod": 10,
    "clusterThreshold": 0.42,
    "clearRadiusAroundHearth": 5,
    "maxSlope": 20,
    "hearthGrove": {
      "inner": 9,
      "outer": 15,
      "density": 0.25
    }
  },
  "hearth": {
    "flatRadius": 3,
    "minHeightAboveSea": 16,
    "maxSiteRange": 40,
    "minSpacingFracOfSize": 0.28
  },
  "wild": {
    "distance": [
      8,
      16
    ]
  },
  "rocks": {
    "$comment": "BACKLOG 0c: stone outcrops, perHearth on the Hearth's landmass at distance cells, plus a scatter over all land; trees within clearTreesRadius of a rock are not planted.",
    "perHearth": 3,
    "distance": [
      8,
      14
    ],
    "scatterPerThousandLand": 1.2,
    "clearTreesRadius": 1.5
  },
  "maxRerolls": 12,
  "gen": {
    "$comment": "BACKLOG 34: generator constants (were code literals). shoreGap: generated sea stays at or below sea - gap and land starts at sea + gap. treeMinAboveSea also gates rocks and tree regrowth.",
    "shoreGap": 2,
    "treeMinAboveSea": 4,
    "treeDensityScale": 4,
    "treeJitterMin": 0.2,
    "treeJitterSpan": 0.6,
    "placeTries": 24,
    "hearthCandidateStride": 2,
    "rockSpacing": 3,
    "rockHearthExtra": 3
  },
  "ops": {
    "$comment": "BACKLOG 34: terrain op shapes (were code literals); spell sizes stay in spells.json.",
    "buildableAboveSea": 2,
    "erodeFloorDrownDepths": 2,
    "flattenPlateau": 0.75,
    "ridgeTaper": 1.5,
    "craterVentRadius": 0.15,
    "craterVentDepth": 0.25,
    "scarCrackAbove": 0.85,
    "scarCrack": 0.8,
    "scarBase": 0.4,
    "scarNoise": 0.6
  }
}
